Rob Crowell,I found the syntax hard to understand until I realized you can think of it exactly like nested for loops. for sublist in l: for item in sublist: yield item,"Jul 27, 2011 at 16:43",https://stackoverflow.com/questions/952914/how-do-i-make-a-flat-list-out-of-a-list-of-lists,How do I make a flat list out of a list of lists?,answer
John Mee,[leaf for tree in forest for leaf in tree] might be easier to comprehend and apply.,"Aug 29, 2013 at 1:38",https://stackoverflow.com/questions/952914/how-do-i-make-a-flat-list-out-of-a-list-of-lists,How do I make a flat list out of a list of lists?,answer
Sнаđошƒаӽ,"@RobCrowell Same here. To me the list comprehension one doesn't read right, something feels off about it - I always seem to get it wrong and end up googling. To me this reads right [leaf for leaf in tree for tree in forest]. I wish this is how it was. I am sure I am missing something about the grammar here, and I would appreciate if anyone could point that out.","Jul 12, 2021 at 17:19",https://stackoverflow.com/questions/952914/how-do-i-make-a-flat-list-out-of-a-list-of-lists,How do I make a flat list out of a list of lists?,answer
Gilthans,"I kept looking here every time I wanted to flatten a list, but this gif is what drove it home: i.stack.imgur.com/0GoV5.gif","Aug 11, 2021 at 12:04",https://stackoverflow.com/questions/952914/how-do-i-make-a-flat-list-out-of-a-list-of-lists,How do I make a flat list out of a list of lists?,answer
Tim Dierks,"The * is the tricky thing that makes chain less straightforward than the list comprehension. You have to know that chain only joins together the iterables passed as parameters, and the * causes the top-level list to be expanded into parameters, so chain joins together all those iterables, but doesn't descend further. I think this makes the comprehension more readable than the use of chain in this case.","Sep 3, 2014 at 14:13",https://stackoverflow.com/questions/952914/how-do-i-make-a-flat-list-out-of-a-list-of-lists,How do I make a flat list out of a list of lists?,answer
ShadowRanger,"@TimDierks: I'm not sure ""this requires you to understand Python syntax"" is an argument against using a given technique in Python. Sure, complex usage could confuse, but the ""splat"" operator is generally useful in many circumstances, and this isn't using it in a particularly obscure way; rejecting all language features that aren't necessarily obvious to beginning users means you're tying one hand behind your back. May as well throw out list comprehensions too while you're at it; users from other backgrounds would find a for loop that repeatedly appends more obvious.","Nov 12, 2015 at 20:26",https://stackoverflow.com/questions/952914/how-do-i-make-a-flat-list-out-of-a-list-of-lists,How do I make a flat list out of a list of lists?,answer
nadapez,* creates an intermediary tuple.! from_iterable fetch the nested lists directly from the top list.,"Oct 21, 2021 at 3:35",https://stackoverflow.com/questions/952914/how-do-i-make-a-flat-list-out-of-a-list-of-lists,How do I make a flat list out of a list of lists?,answer
Chris Collett,"To make this more readable, you can make a simple function: def flatten_list(deep_list: list[list[object]]): return list(chain.from_iterable(deep_list)). The type hinting improves the clarity of what's going on (modern IDEs would interpret this as returning a list[object] type).","Oct 25, 2021 at 14:34",https://stackoverflow.com/questions/952914/how-do-i-make-a-flat-list-out-of-a-list-of-lists,How do I make a flat list out of a list of lists?,answer
andrewrk,that's pretty neat and clever but I wouldn't use it because it's confusing to read.,"Jun 15, 2010 at 18:55",https://stackoverflow.com/questions/952914/how-do-i-make-a-flat-list-out-of-a-list-of-lists,How do I make a flat list out of a list of lists?,answer
Mike Graham,This is a Shlemiel the painter's algorithm joelonsoftware.com/articles/fog0000000319.html -- unnecessarily inefficient as well as unnecessarily ugly.,"Apr 25, 2012 at 18:24",https://stackoverflow.com/questions/952914/how-do-i-make-a-flat-list-out-of-a-list-of-lists,How do I make a flat list out of a list of lists?,answer
ulidtko,"The append operation on lists forms a Monoid, which is one of the most convenient abstractions for thinking of a + operation in a general sense (not limited to numbers only). So this answer deserves a +1 from me for (correct) treatment of lists as a monoid. The performance is concerning though...","Dec 3, 2014 at 10:35",https://stackoverflow.com/questions/952914/how-do-i-make-a-flat-list-out-of-a-list-of-lists,How do I make a flat list out of a list of lists?,answer
Jean-François Fabre,this is a very inefficient way because of the quadratic aspect of the sum.,"Jul 31, 2017 at 18:04",https://stackoverflow.com/questions/952914/how-do-i-make-a-flat-list-out-of-a-list-of-lists,How do I make a flat list out of a list of lists?,answer
ds4940,This article explains the maths of the inefficiency mathieularose.com/how-not-to-flatten-a-list-of-lists-in-python,"Jan 4, 2018 at 16:46",https://stackoverflow.com/questions/952914/how-do-i-make-a-flat-list-out-of-a-list-of-lists,How do I make a flat list out of a list of lists?,answer
Sara,"For huge nested lists,' list(numpy.array(a).flat)' is the fastest among all functions above.","Jan 20, 2019 at 13:57",https://stackoverflow.com/questions/952914/how-do-i-make-a-flat-list-out-of-a-list-of-lists,How do I make a flat list out of a list of lists?,answer
Leo,Is there a way to do a 3-d perfplot? number of arrays by average size of array?,"Apr 30, 2020 at 0:31",https://stackoverflow.com/questions/952914/how-do-i-make-a-flat-list-out-of-a-list-of-lists,How do I make a flat list out of a list of lists?,answer
Boris Verkhovskiy,"@Sara can you define ""huge"" please?","Nov 14, 2020 at 6:05",https://stackoverflow.com/questions/952914/how-do-i-make-a-flat-list-out-of-a-list-of-lists,How do I make a flat list out of a list of lists?,answer
mirekphd,"Tried numpy_flat on the test example from Rossetta Code (link) and got VisibleDeprecationWarning: Creating an ndarray from ragged nested sequences (which is a list-or-tuple of lists-or-tuples-or ndarrays with different lengths or shapes) is deprecated. If you meant to do this, you must specify 'dtype=object' when creating the ndarray","Dec 5, 2020 at 11:08",https://stackoverflow.com/questions/952914/how-do-i-make-a-flat-list-out-of-a-list-of-lists,How do I make a flat list out of a list of lists?,answer
Oscar Benjamin,One option missed above which shows up faster for my particular case i just items = []; for sublist in a: items.extend(sublist); return sublist,"Oct 11, 2021 at 17:05",https://stackoverflow.com/questions/952914/how-do-i-make-a-flat-list-out-of-a-list-of-lists,How do I make a flat list out of a list of lists?,answer
Mike Graham,This is a Shlemiel the painter's algorithm joelonsoftware.com/articles/fog0000000319.html,"Apr 25, 2012 at 18:26",https://stackoverflow.com/questions/952914/how-do-i-make-a-flat-list-out-of-a-list-of-lists,How do I make a flat list out of a list of lists?,answer
gntskn,"reduce is very inefficient for this use case as it will repeat copies and generate many unused temporary lists (O(n^2) in both time and possibly space, depending on how the GC decides to clean). It's better to use append or extend.","Oct 2, 2020 at 17:00",https://stackoverflow.com/questions/952914/how-do-i-make-a-flat-list-out-of-a-list-of-lists,How do I make a flat list out of a list of lists?,answer
Martin Thoma,"I just wrote pretty much the same, because I didn't see your solution ... here is what I looked for ""recursively flatten complete multiple lists"" ... (+1)","Mar 25, 2017 at 15:32",https://stackoverflow.com/questions/952914/how-do-i-make-a-flat-list-out-of-a-list-of-lists,How do I make a flat list out of a list of lists?,answer
pylang,"@MartinThoma Much appreciated. FYI, if flattening nested iterables is a common practice for you, there are some third-party packages that handle this well. This may save from reinventing the wheel. I've mentioned more_itertools among others discussed in this post. Cheers.","Mar 25, 2017 at 17:51",https://stackoverflow.com/questions/952914/how-do-i-make-a-flat-list-out-of-a-list-of-lists,How do I make a flat list out of a list of lists?,answer
Wolf,"Maybe traverse could also be a good name for this way of a tree, whereas I'd keep it less universal for this answer by sticking to nested lists.","Jun 15, 2017 at 10:22",https://stackoverflow.com/questions/952914/how-do-i-make-a-flat-list-out-of-a-list-of-lists,How do I make a flat list out of a list of lists?,answer
Ryan Allen,"You can check if hasattr(x, '__iter__') instead of importing/checking against Iterable and that will exclude strings as well.","Apr 30, 2018 at 16:46",https://stackoverflow.com/questions/952914/how-do-i-make-a-flat-list-out-of-a-list-of-lists,How do I make a flat list out of a list of lists?,answer
sunnyX,"the above code doesnt seem to work for if one of the nested lists is having a list of strings. [1, 2, [3, 4], [4], [], 9, 9.5, 'ssssss', ['str', 'sss', 'ss'], [3, 4, 5]] output:- [1, 2, 3, 4, 4, 9, 9.5, 'ssssss', 3, 4, 5]","Jun 12, 2019 at 21:35",https://stackoverflow.com/questions/952914/how-do-i-make-a-flat-list-out-of-a-list-of-lists,How do I make a flat list out of a list of lists?,answer
kylebebak,OP doesn't mention they want to use numpy. Python has good ways of doing this without relying on a library,"Oct 3, 2021 at 1:01",https://stackoverflow.com/questions/952914/how-do-i-make-a-flat-list-out-of-a-list-of-lists,How do I make a flat list out of a list of lists?,answer
viddik13,If you can afford adding a package to your project - this answer is best,"Mar 5, 2020 at 15:53",https://stackoverflow.com/questions/952914/how-do-i-make-a-flat-list-out-of-a-list-of-lists,How do I make a flat list out of a list of lists?,answer
Sajad.sni,"it fails when all elements are not list. (e.g. lst=[1, [2,3]]). of course integer is not iterable.","Sep 8, 2020 at 8:32",https://stackoverflow.com/questions/952914/how-do-i-make-a-flat-list-out-of-a-list-of-lists,How do I make a flat list out of a list of lists?,answer
viddik13,"also, mind that list of strings will be flattened to a list of characters","Oct 30, 2020 at 2:05",https://stackoverflow.com/questions/952914/how-do-i-make-a-flat-list-out-of-a-list-of-lists,How do I make a flat list out of a list of lists?,answer
agf,"extend is better used as newlist = [], extend = newlist.extend, for sublist in l: extend(l) as it avoids the (rather large) overhead of the lambda, the attribute lookup on x, and the or.","Sep 24, 2011 at 10:12",https://stackoverflow.com/questions/952914/how-do-i-make-a-flat-list-out-of-a-list-of-lists,How do I make a flat list out of a list of lists?,answer
Markus Dutschke,for python 3 add from functools import reduce,"Jul 2, 2019 at 12:24",https://stackoverflow.com/questions/952914/how-do-i-make-a-flat-list-out-of-a-list-of-lists,How do I make a flat list out of a list of lists?,answer
Uriya Harpeness,This answer is already up in this question: stackoverflow.com/a/952946/14273548,"Dec 9, 2021 at 9:24",https://stackoverflow.com/questions/952914/how-do-i-make-a-flat-list-out-of-a-list-of-lists,How do I make a flat list out of a list of lists?,answer
Arel,"Neat! Though the other answer here, stackoverflow.com/a/952946/14273548, explains the reasons this solution should generally be avoided (it's inefficient and confusing.)","Dec 29, 2021 at 20:29",https://stackoverflow.com/questions/952914/how-do-i-make-a-flat-list-out-of-a-list-of-lists,How do I make a flat list out of a list of lists?,answer
Culpepper,Will also give a TypeError if your list contains a tuple,Jan 31 at 18:42,https://stackoverflow.com/questions/952914/how-do-i-make-a-flat-list-out-of-a-list-of-lists,How do I make a flat list out of a list of lists?,answer
juanpa.arrivillaga,why would you use a tuple? now your solution is inefficient.,"Jul 31, 2021 at 18:53",https://stackoverflow.com/questions/952914/how-do-i-make-a-flat-list-out-of-a-list-of-lists,How do I make a flat list out of a list of lists?,answer
juanpa.arrivillaga,"And with any sequence, sum((flatten(e) for e in itr), tuple()) is highly inefficient,","Jul 31, 2021 at 18:53",https://stackoverflow.com/questions/952914/how-do-i-make-a-flat-list-out-of-a-list-of-lists,How do I make a flat list out of a list of lists?,answer
mmj,"@juanpa.arrivillaga Your comment made me think about improving my answer and I think I found a better one, what do you think?","Aug 1, 2021 at 17:37",https://stackoverflow.com/questions/952914/how-do-i-make-a-flat-list-out-of-a-list-of-lists,How do I make a flat list out of a list of lists?,answer
EL_DON,"Doesn't work for unevenly nested lists like [1, 2, [3], [[4]], [5, [6]]]","Apr 22, 2019 at 21:39",https://stackoverflow.com/questions/952914/how-do-i-make-a-flat-list-out-of-a-list-of-lists,How do I make a flat list out of a list of lists?,answer
EL_DON,"@juanpa.arrivillaga it's a simple and natural extension of the question, though. Answers that can handle greater depth of nesting are more likely to be useful to someone who finds this question.","Aug 2, 2021 at 19:53",https://stackoverflow.com/questions/952914/how-do-i-make-a-flat-list-out-of-a-list-of-lists,How do I make a flat list out of a list of lists?,answer
pylang,"If you are still interested in Python 2 compatibility, change yield from to a for loop, e.g. for x in flatten(i): yield x","Jun 19, 2018 at 19:06",https://stackoverflow.com/questions/952914/how-do-i-make-a-flat-list-out-of-a-list-of-lists,How do I make a flat list out of a list of lists?,answer
EL_DON,"Fails for python2.7 for the example nested list in the question: [[1, 2, 3], [4, 5, 6], [7], [8, 9]]","Apr 22, 2019 at 21:34",https://stackoverflow.com/questions/952914/how-do-i-make-a-flat-list-out-of-a-list-of-lists,How do I make a flat list out of a list of lists?,answer
Maciek,Why extend([l]) instead of append(l)?,"Apr 9, 2020 at 18:31",https://stackoverflow.com/questions/952914/how-do-i-make-a-flat-list-out-of-a-list-of-lists,How do I make a flat list out of a list of lists?,answer
Darkonaut,"That's just a more complicated and a bit slower way of what ᴡʜᴀᴄᴋᴀᴍᴀᴅᴏᴏᴅʟᴇ3000 already posted before. I reinvented his proposal yesterday, so this approach seems quite popular these days ;)","Jan 10, 2018 at 22:03",https://stackoverflow.com/questions/952914/how-do-i-make-a-flat-list-out-of-a-list-of-lists,How do I make a flat list out of a list of lists?,answer
tharndt,"Not quite: wierd_list = [[1, 2, 3], [4, 5, 6], [7], [8, 9], 10] >> nice_list=[1, 2, 3, 4, 5, 6, 7, 8, 9, 1, 0]","Jan 11, 2018 at 8:17",https://stackoverflow.com/questions/952914/how-do-i-make-a-flat-list-out-of-a-list-of-lists,How do I make a flat list out of a list of lists?,answer
tharndt,"my code as one liner would be : flat_list = [int(e.replace('[','').replace(']','')) for e in str(deep_list).split(',')]","Jan 11, 2018 at 8:32",https://stackoverflow.com/questions/952914/how-do-i-make-a-flat-list-out-of-a-list-of-lists,How do I make a flat list out of a list of lists?,answer
Darkonaut,"You are indeed right +1, ᴡʜᴀᴄᴋᴀᴍᴀᴅᴏᴏᴅʟᴇ3000's proposal won't work with multiple digit numbers, I also didn't test this before although it should be obvious. You could simplify your code and write [int(e.strip('[ ]')) for e in str(deep_list).split(',')]. But I'd suggest to stick with Deleet's proposal for real use cases. It doesn't contain hacky type transformations, it's faster and more versatile because it naturally also handles lists with mixed types.","Jan 11, 2018 at 16:31",https://stackoverflow.com/questions/952914/how-do-i-make-a-flat-list-out-of-a-list-of-lists,How do I make a flat list out of a list of lists?,answer
tharndt,Unfortunately no. But I saw this code recently here: Python Practice Book 6.1.2,"Jan 15, 2018 at 8:18",https://stackoverflow.com/questions/952914/how-do-i-make-a-flat-list-out-of-a-list-of-lists,How do I make a flat list out of a list of lists?,answer
Adriaan,"Welcome to Stack Overflow! Please note that this is not your favourite Python forum, but rather a question and answer site for all programming related questions. Thus, please always include the tag of the language you are working with. This way, more people can find your question and won't have to go looking for what programming language you're using.",Jun 10 at 10:00,https://stackoverflow.com/questions/72572380/unique-combinations-of-all-elements-from-long-python-list-with-elements-from-sho,Unique combinations of all elements from long python list with elements from shorter list,original
Karl Knechtel,"""I want to obtain all possible unique combinations so that all trips are matched with a truck in the trucks list."" I can't understand the description. Could you show a few possible outputs? Do you know how many outputs there should be, for this input? Are you able to solve the problem by hand for a small input?",Jun 10 at 10:26,https://stackoverflow.com/questions/72572380/unique-combinations-of-all-elements-from-long-python-list-with-elements-from-sho,Unique combinations of all elements from long python list with elements from shorter list,original
Karl Knechtel,"It sounds like the goal, for the 12 trip / 3 truck case, is to choose 4 trips (without replacement or reordering) that correspond to truck A, 4 for truck B and 4 for truck C, correct? If I understood it right, then the possibilities for truck A are combinations (not permutations) of 4 of the original 12; in each of those sub-cases, the possibilities for truck B are combinations of 4 of the other 8; the possibilities for C are pre-determined.",Jun 10 at 10:28,https://stackoverflow.com/questions/72572380/unique-combinations-of-all-elements-from-long-python-list-with-elements-from-sho,Unique combinations of all elements from long python list with elements from shorter list,original
Karl Knechtel,"""Moreover, extra_trips =..."" I can't understand what this is supposed to tell us. Suppose for example that there are 11 trips and 3 trucks. Exactly what should happen? Should every trip be attempted by a truck, or will each output possibility leave two unassigned trips? If every trip is assigned, what is the rule for how they are divided up?",Jun 10 at 10:33,https://stackoverflow.com/questions/72572380/unique-combinations-of-all-elements-from-long-python-list-with-elements-from-sho,Unique combinations of all elements from long python list with elements from shorter list,original
artificial_f,"Hi Karl, I think you understand it quite good yes. regarding the extr_trips, that's just the remainder of the division nr_of_trips/nr_of_trucks. For the 12 trip/ 3 trucks case that is zero so no worries. But for the 4 trip/3 trucks case, that means that in every comb, where each truck is matched with one trip, one truck has to be matched also with this ""extra_trip"". That generates even more combinations as I would like to return all possible unique combinations for the 'orphan' trip.",Jun 10 at 10:46,https://stackoverflow.com/questions/72572380/unique-combinations-of-all-elements-from-long-python-list-with-elements-from-sho,Unique combinations of all elements from long python list with elements from shorter list,original
artificial_f,That was brilliant thank you Sam!,Jun 10 at 11:09,https://stackoverflow.com/questions/72572380/unique-combinations-of-all-elements-from-long-python-list-with-elements-from-sho,Unique combinations of all elements from long python list with elements from shorter list,answer
artificial_f,"Well, do you maybe have an efficient way to drop duplicates? Because when I implement your function to my code to get the combs, the amount of combs I get for 9 or 10 trips is extremely large due to duplicates. I manage to drop them in another line however when the case is 12 trips / 3 trucks the combs get outstandingly large with duplicates and takes too long to calculate",Jun 10 at 11:20,https://stackoverflow.com/questions/72572380/unique-combinations-of-all-elements-from-long-python-list-with-elements-from-sho,Unique combinations of all elements from long python list with elements from shorter list,answer
Sam Mason,"all permutations of a long list will always be a lot of items, you probably want to change your algorithm so you don't need to calculate it directly. e.g. have a look at en.wikipedia.org/wiki/Dijkstra%27s_algorithm",Jun 10 at 11:31,https://stackoverflow.com/questions/72572380/unique-combinations-of-all-elements-from-long-python-list-with-elements-from-sho,Unique combinations of all elements from long python list with elements from shorter list,answer
Sam Mason,"that said, my code won't give duplicates, so you might want to look at why your code is making duplicates in the first place",Jun 10 at 11:41,https://stackoverflow.com/questions/72572380/unique-combinations-of-all-elements-from-long-python-list-with-elements-from-sho,Unique combinations of all elements from long python list with elements from shorter list,answer
artificial_f,"I mean I use your code in mine above like this: combs = [list(zip(cycle(trucks), x)) for x in itertools.permutations(trips,len(trips))] . This produces many dublicate entries in t and the more the trips the more the dublicates. When I drop them I get the desired result however when trips are many then the dublicates are so many that it takes ages. I was wondering if you have any smart way to avoid them",Jun 10 at 12:23,https://stackoverflow.com/questions/72572380/unique-combinations-of-all-elements-from-long-python-list-with-elements-from-sho,Unique combinations of all elements from long python list with elements from shorter list,answer
artificial_f,That doesn't help much. The code:,Jun 10 at 10:22,https://stackoverflow.com/questions/72572380/unique-combinations-of-all-elements-from-long-python-list-with-elements-from-sho,Unique combinations of all elements from long python list with elements from shorter list,answer
Tau n Ro,@Fotis here you have an explanation of (cartesian product)[en.wikipedia.org/wiki/Cartesian_product] that's exactly what you're searching I think.,Jun 10 at 10:49,https://stackoverflow.com/questions/72572380/unique-combinations-of-all-elements-from-long-python-list-with-elements-from-sho,Unique combinations of all elements from long python list with elements from shorter list,answer
CrazyChucky,This is not what they asked for at all.,Jun 10 at 13:34,https://stackoverflow.com/questions/72572380/unique-combinations-of-all-elements-from-long-python-list-with-elements-from-sho,Unique combinations of all elements from long python list with elements from shorter list,answer
Tau n Ro,"Yeah, I saw it after @CrazyChucky, take it easy.",Jun 10 at 14:47,https://stackoverflow.com/questions/72572380/unique-combinations-of-all-elements-from-long-python-list-with-elements-from-sho,Unique combinations of all elements from long python list with elements from shorter list,answer
monk,"This SO question is about strings, but it might be helpful nonetheless.",Jun 9 at 8:04,https://stackoverflow.com/questions/72556685/check-if-python-list-elemnts-respect-a-pattern,Check if python list elemnts respect a pattern,original
sundar nataraj,what is ur expected output of above list,"May 8, 2014 at 12:19",https://stackoverflow.com/questions/23541567/find-numbers-in-python-list-which-are-within-a-certain-distance-of-each-other,Find numbers in Python list which are within a certain distance of each other,original
user1022788,"Output would ideally be [84, 86, 87, 89, 90] and another list [997, 999, 1000, 1002]","May 8, 2014 at 12:21",https://stackoverflow.com/questions/23541567/find-numbers-in-python-list-which-are-within-a-certain-distance-of-each-other,Find numbers in Python list which are within a certain distance of each other,original
reto,Please update your question with the expected output. Is there a minimal size of that list? If no [2014] would be a solution too.,"May 8, 2014 at 12:22",https://stackoverflow.com/questions/23541567/find-numbers-in-python-list-which-are-within-a-certain-distance-of-each-other,Find numbers in Python list which are within a certain distance of each other,original
sundar nataraj,how to find which is middle element ..like 87 . we have to consider first element as middle element when v start searching.,"May 8, 2014 at 12:24",https://stackoverflow.com/questions/23541567/find-numbers-in-python-list-which-are-within-a-certain-distance-of-each-other,Find numbers in Python list which are within a certain distance of each other,original
yoopoo,"what about such a list: [2,5,8,10,12]?","May 8, 2014 at 12:44",https://stackoverflow.com/questions/23541567/find-numbers-in-python-list-which-are-within-a-certain-distance-of-each-other,Find numbers in Python list which are within a certain distance of each other,original
yellowantphil,Could you give more details? Show some code?,"Feb 24, 2016 at 18:04",https://stackoverflow.com/questions/35609614/kivy-python-list-to-button-text,kivy python List to button text,original
Allan Brooke,added code as best I can new to this first post be gentle,"Feb 25, 2016 at 20:00",https://stackoverflow.com/questions/35609614/kivy-python-list-to-button-text,kivy python List to button text,original
ForceBru,You definitely should format your code. For more info visit Help Center,"Feb 25, 2016 at 20:03",https://stackoverflow.com/questions/35609614/kivy-python-list-to-button-text,kivy python List to button text,original
Allan Brooke,I wanted to use kv file for kv builder string to keep Layout separate and to use kv features where possible,"Feb 26, 2016 at 15:11",https://stackoverflow.com/questions/35609614/kivy-python-list-to-button-text,kivy python List to button text,original
IanS,Adding some explanations for OP would be nice.,"Feb 26, 2016 at 5:42",https://stackoverflow.com/questions/35609614/kivy-python-list-to-button-text,kivy python List to button text,answer
