Oscar Benjamin,One option missed above which shows up faster for my particular case i just items = []; for sublist in a: items.extend(sublist); return sublist,"Oct 11, 2021 at 17:05",https://stackoverflow.com/questions/952914/how-do-i-make-a-flat-list-out-of-a-list-of-lists,How do I make a flat list out of a list of lists?,answer
Mike Graham,This is a Shlemiel the painter's algorithm joelonsoftware.com/articles/fog0000000319.html,"Apr 25, 2012 at 18:26",https://stackoverflow.com/questions/952914/how-do-i-make-a-flat-list-out-of-a-list-of-lists,How do I make a flat list out of a list of lists?,answer
gntskn,"reduce is very inefficient for this use case as it will repeat copies and generate many unused temporary lists (O(n^2) in both time and possibly space, depending on how the GC decides to clean). It's better to use append or extend.","Oct 2, 2020 at 17:00",https://stackoverflow.com/questions/952914/how-do-i-make-a-flat-list-out-of-a-list-of-lists,How do I make a flat list out of a list of lists?,answer
Martin Thoma,"I just wrote pretty much the same, because I didn't see your solution ... here is what I looked for ""recursively flatten complete multiple lists"" ... (+1)","Mar 25, 2017 at 15:32",https://stackoverflow.com/questions/952914/how-do-i-make-a-flat-list-out-of-a-list-of-lists,How do I make a flat list out of a list of lists?,answer
pylang,"@MartinThoma Much appreciated. FYI, if flattening nested iterables is a common practice for you, there are some third-party packages that handle this well. This may save from reinventing the wheel. I've mentioned more_itertools among others discussed in this post. Cheers.","Mar 25, 2017 at 17:51",https://stackoverflow.com/questions/952914/how-do-i-make-a-flat-list-out-of-a-list-of-lists,How do I make a flat list out of a list of lists?,answer
Wolf,"Maybe traverse could also be a good name for this way of a tree, whereas I'd keep it less universal for this answer by sticking to nested lists.","Jun 15, 2017 at 10:22",https://stackoverflow.com/questions/952914/how-do-i-make-a-flat-list-out-of-a-list-of-lists,How do I make a flat list out of a list of lists?,answer
Ryan Allen,"You can check if hasattr(x, '__iter__') instead of importing/checking against Iterable and that will exclude strings as well.","Apr 30, 2018 at 16:46",https://stackoverflow.com/questions/952914/how-do-i-make-a-flat-list-out-of-a-list-of-lists,How do I make a flat list out of a list of lists?,answer
sunnyX,"the above code doesnt seem to work for if one of the nested lists is having a list of strings. [1, 2, [3, 4], [4], [], 9, 9.5, 'ssssss', ['str', 'sss', 'ss'], [3, 4, 5]] output:- [1, 2, 3, 4, 4, 9, 9.5, 'ssssss', 3, 4, 5]","Jun 12, 2019 at 21:35",https://stackoverflow.com/questions/952914/how-do-i-make-a-flat-list-out-of-a-list-of-lists,How do I make a flat list out of a list of lists?,answer
kylebebak,OP doesn't mention they want to use numpy. Python has good ways of doing this without relying on a library,"Oct 3, 2021 at 1:01",https://stackoverflow.com/questions/952914/how-do-i-make-a-flat-list-out-of-a-list-of-lists,How do I make a flat list out of a list of lists?,answer
viddik13,If you can afford adding a package to your project - this answer is best,"Mar 5, 2020 at 15:53",https://stackoverflow.com/questions/952914/how-do-i-make-a-flat-list-out-of-a-list-of-lists,How do I make a flat list out of a list of lists?,answer
Sajad.sni,"it fails when all elements are not list. (e.g. lst=[1, [2,3]]). of course integer is not iterable.","Sep 8, 2020 at 8:32",https://stackoverflow.com/questions/952914/how-do-i-make-a-flat-list-out-of-a-list-of-lists,How do I make a flat list out of a list of lists?,answer
viddik13,"also, mind that list of strings will be flattened to a list of characters","Oct 30, 2020 at 2:05",https://stackoverflow.com/questions/952914/how-do-i-make-a-flat-list-out-of-a-list-of-lists,How do I make a flat list out of a list of lists?,answer
agf,"extend is better used as newlist = [], extend = newlist.extend, for sublist in l: extend(l) as it avoids the (rather large) overhead of the lambda, the attribute lookup on x, and the or.","Sep 24, 2011 at 10:12",https://stackoverflow.com/questions/952914/how-do-i-make-a-flat-list-out-of-a-list-of-lists,How do I make a flat list out of a list of lists?,answer
Markus Dutschke,for python 3 add from functools import reduce,"Jul 2, 2019 at 12:24",https://stackoverflow.com/questions/952914/how-do-i-make-a-flat-list-out-of-a-list-of-lists,How do I make a flat list out of a list of lists?,answer
Uriya Harpeness,This answer is already up in this question: stackoverflow.com/a/952946/14273548,"Dec 9, 2021 at 9:24",https://stackoverflow.com/questions/952914/how-do-i-make-a-flat-list-out-of-a-list-of-lists,How do I make a flat list out of a list of lists?,answer
Arel,"Neat! Though the other answer here, stackoverflow.com/a/952946/14273548, explains the reasons this solution should generally be avoided (it's inefficient and confusing.)","Dec 29, 2021 at 20:29",https://stackoverflow.com/questions/952914/how-do-i-make-a-flat-list-out-of-a-list-of-lists,How do I make a flat list out of a list of lists?,answer
Culpepper,Will also give a TypeError if your list contains a tuple,Jan 31 at 18:42,https://stackoverflow.com/questions/952914/how-do-i-make-a-flat-list-out-of-a-list-of-lists,How do I make a flat list out of a list of lists?,answer
juanpa.arrivillaga,why would you use a tuple? now your solution is inefficient.,"Jul 31, 2021 at 18:53",https://stackoverflow.com/questions/952914/how-do-i-make-a-flat-list-out-of-a-list-of-lists,How do I make a flat list out of a list of lists?,answer
juanpa.arrivillaga,"And with any sequence, sum((flatten(e) for e in itr), tuple()) is highly inefficient,","Jul 31, 2021 at 18:53",https://stackoverflow.com/questions/952914/how-do-i-make-a-flat-list-out-of-a-list-of-lists,How do I make a flat list out of a list of lists?,answer
mmj,"@juanpa.arrivillaga Your comment made me think about improving my answer and I think I found a better one, what do you think?","Aug 1, 2021 at 17:37",https://stackoverflow.com/questions/952914/how-do-i-make-a-flat-list-out-of-a-list-of-lists,How do I make a flat list out of a list of lists?,answer
EL_DON,"Doesn't work for unevenly nested lists like [1, 2, [3], [[4]], [5, [6]]]","Apr 22, 2019 at 21:39",https://stackoverflow.com/questions/952914/how-do-i-make-a-flat-list-out-of-a-list-of-lists,How do I make a flat list out of a list of lists?,answer
EL_DON,"@juanpa.arrivillaga it's a simple and natural extension of the question, though. Answers that can handle greater depth of nesting are more likely to be useful to someone who finds this question.","Aug 2, 2021 at 19:53",https://stackoverflow.com/questions/952914/how-do-i-make-a-flat-list-out-of-a-list-of-lists,How do I make a flat list out of a list of lists?,answer
pylang,"If you are still interested in Python 2 compatibility, change yield from to a for loop, e.g. for x in flatten(i): yield x","Jun 19, 2018 at 19:06",https://stackoverflow.com/questions/952914/how-do-i-make-a-flat-list-out-of-a-list-of-lists,How do I make a flat list out of a list of lists?,answer
EL_DON,"Fails for python2.7 for the example nested list in the question: [[1, 2, 3], [4, 5, 6], [7], [8, 9]]","Apr 22, 2019 at 21:34",https://stackoverflow.com/questions/952914/how-do-i-make-a-flat-list-out-of-a-list-of-lists,How do I make a flat list out of a list of lists?,answer
Maciek,Why extend([l]) instead of append(l)?,"Apr 9, 2020 at 18:31",https://stackoverflow.com/questions/952914/how-do-i-make-a-flat-list-out-of-a-list-of-lists,How do I make a flat list out of a list of lists?,answer
Darkonaut,"That's just a more complicated and a bit slower way of what ᴡʜᴀᴄᴋᴀᴍᴀᴅᴏᴏᴅʟᴇ3000 already posted before. I reinvented his proposal yesterday, so this approach seems quite popular these days ;)","Jan 10, 2018 at 22:03",https://stackoverflow.com/questions/952914/how-do-i-make-a-flat-list-out-of-a-list-of-lists,How do I make a flat list out of a list of lists?,answer
tharndt,"Not quite: wierd_list = [[1, 2, 3], [4, 5, 6], [7], [8, 9], 10] >> nice_list=[1, 2, 3, 4, 5, 6, 7, 8, 9, 1, 0]","Jan 11, 2018 at 8:17",https://stackoverflow.com/questions/952914/how-do-i-make-a-flat-list-out-of-a-list-of-lists,How do I make a flat list out of a list of lists?,answer
tharndt,"my code as one liner would be : flat_list = [int(e.replace('[','').replace(']','')) for e in str(deep_list).split(',')]","Jan 11, 2018 at 8:32",https://stackoverflow.com/questions/952914/how-do-i-make-a-flat-list-out-of-a-list-of-lists,How do I make a flat list out of a list of lists?,answer
Darkonaut,"You are indeed right +1, ᴡʜᴀᴄᴋᴀᴍᴀᴅᴏᴏᴅʟᴇ3000's proposal won't work with multiple digit numbers, I also didn't test this before although it should be obvious. You could simplify your code and write [int(e.strip('[ ]')) for e in str(deep_list).split(',')]. But I'd suggest to stick with Deleet's proposal for real use cases. It doesn't contain hacky type transformations, it's faster and more versatile because it naturally also handles lists with mixed types.","Jan 11, 2018 at 16:31",https://stackoverflow.com/questions/952914/how-do-i-make-a-flat-list-out-of-a-list-of-lists,How do I make a flat list out of a list of lists?,answer
tharndt,Unfortunately no. But I saw this code recently here: Python Practice Book 6.1.2,"Jan 15, 2018 at 8:18",https://stackoverflow.com/questions/952914/how-do-i-make-a-flat-list-out-of-a-list-of-lists,How do I make a flat list out of a list of lists?,answer
Claudiu,"these are NOT equivalent - the list comprehension is many times faster, as it doesn't have to do any function lookups. the appropriate translation would use for loops.","Nov 22, 2008 at 19:38",https://stackoverflow.com/questions/311588/how-to-indent-python-list-comprehensions,How to indent Python list-comprehensions?,answer
Geo,"Except for the performance hit , this is a very readable example !","Nov 22, 2008 at 19:51",https://stackoverflow.com/questions/311588/how-to-indent-python-list-comprehensions,How to indent Python list-comprehensions?,answer
orestis,"How would for loops prevent the function lookup? Also note that the loop in list comprehensions is implemented in C, and is therefore faster than the plain one.","Nov 22, 2008 at 20:01",https://stackoverflow.com/questions/311588/how-to-indent-python-list-comprehensions,How to indent Python list-comprehensions?,answer
cdleary,"Just a note -- you can use multiple if statements instead of using ""and"" multiple times. Kind of a funny little syntax truth.","Nov 24, 2008 at 5:17",https://stackoverflow.com/questions/311588/how-to-indent-python-list-comprehensions,How to indent Python list-comprehensions?,answer
Alex Harvey,pycodestyle emits E131 continuation line unaligned for hanging indent for this.,"Jun 13, 2021 at 6:45",https://stackoverflow.com/questions/311588/how-to-indent-python-list-comprehensions,How to indent Python list-comprehensions?,answer
Claudiu,"this is a teeny bit slower, as you have to build the array step by step","Nov 22, 2008 at 19:59",https://stackoverflow.com/questions/311588/how-to-indent-python-list-comprehensions,How to indent Python list-comprehensions?,answer
e-satis,I think the list comprehension does exactly the same under the hood. It's not because it's a one line expression that this is a one time operation...,"Nov 22, 2008 at 21:31",https://stackoverflow.com/questions/311588/how-to-indent-python-list-comprehensions,How to indent Python list-comprehensions?,answer
orip,"e-statis: the function is the same, but list comprehensions can be significantly faster","Nov 22, 2008 at 23:58",https://stackoverflow.com/questions/311588/how-to-indent-python-list-comprehensions,How to indent Python list-comprehensions?,answer
George Sovetov,"This way employs mutable, non-functional style. Immutability allows thinking in terms of mapping and filtering. In this code, list is changed and reader has to keep in mind that it can be changed afterwards. It's better to make generator function with yield than this, or introduce new variables and functions.","Jul 24, 2016 at 16:23",https://stackoverflow.com/questions/311588/how-to-indent-python-list-comprehensions,How to indent Python list-comprehensions?,answer
Piotr Lesnicki,I second that. Generally lines of more than 80 characters should be avoided in all languages.,"Nov 22, 2008 at 18:19",https://stackoverflow.com/questions/311588/how-to-indent-python-list-comprehensions,How to indent Python list-comprehensions?,answer
Peter Rowell,"Agreed, but Python's syntax rules often encourage/force longer lines. Its whitespace handling in general is about my only complaint about the language.","Nov 22, 2008 at 18:27",https://stackoverflow.com/questions/311588/how-to-indent-python-list-comprehensions,How to indent Python list-comprehensions?,answer
Piotr Lesnicki,"With carefully chosen variables, and spliting lines with parenthesis or brackets, i never had to resort to too long lines (the problem is more often to avoid self.long_foo.very_long_bar.baz(....) using temporaries)","Nov 22, 2008 at 18:33",https://stackoverflow.com/questions/311588/how-to-indent-python-list-comprehensions,How to indent Python list-comprehensions?,answer
Ali Afshar,"About the ""By the way"", it is not totally superfluous, take the case x.deleted = None, for example.","Nov 22, 2008 at 19:05",https://stackoverflow.com/questions/311588/how-to-indent-python-list-comprehensions,How to indent Python list-comprehensions?,answer
Matteo,I'm very new to ROS and am also trying to build a ROS node as both a subscriber and publisher (regardless of the topic's data type). Is it recognized as good practice to achieve this by having global pub and sub variables? Or would it be better to pass pub as an argument to the callback?,"Jun 25, 2018 at 21:24",https://stackoverflow.com/questions/43130377/how-to-publish-subscribe-a-python-list-of-list-as-topic-in-ros,How to publish/subscribe a python “list of list” as topic in ROS,answer
Confused Learner,This returns 'col2' and not the desired DataFrame.,Aug 4 at 14:03,https://stackoverflow.com/questions/73235215/count-occurrences-of-elements-in-python-list-inside-panadas-dataframe-rows,Count occurrences of elements in Python list inside panadas dataframe rows,answer
Mohamed Thasin ah,Check the updated solution,Aug 4 at 14:04,https://stackoverflow.com/questions/73235215/count-occurrences-of-elements-in-python-list-inside-panadas-dataframe-rows,Count occurrences of elements in Python list inside panadas dataframe rows,answer
Thierry Lathuille,"It turns out that str.split("","") - calling the method on the class instead of on an instance - returns the list [','], which map tries to call. See the duplicate for the right way to do what you want.",Aug 4 at 12:39,https://stackoverflow.com/questions/73235922/python-list-object-is-not-callable-while-the-problem-doesnt-come-from-list-bu,python :'list' object is not callable while the problem doesnt come from list but split() [duplicate],original
Mark,reverse() reverses in place. It doesn't return anything. Use list_11 = list(reversed(list_10)),"Apr 16, 2020 at 0:11",https://stackoverflow.com/questions/61240615/python-list-reverse-function,Python List Reverse Function [duplicate],original
juanpa.arrivillaga,"@MarkMeyer note, reversed returns an iterator","Apr 16, 2020 at 0:14",https://stackoverflow.com/questions/61240615/python-list-reverse-function,Python List Reverse Function [duplicate],original
DaveStSomeWhere,You can also use slice list_11 = list_10[-1::-1] to make a copy of the original list in reverse order.,"Apr 16, 2020 at 0:21",https://stackoverflow.com/questions/61240615/python-list-reverse-function,Python List Reverse Function [duplicate],original
juanpa.arrivillaga,the op likely wants to create a new list,"Apr 16, 2020 at 0:16",https://stackoverflow.com/questions/61240615/python-list-reverse-function,Python List Reverse Function [duplicate],answer
Padraic Cunningham,best way is to change to normal for loops and use print to see what is happening,"Sep 4, 2014 at 20:13",https://stackoverflow.com/questions/25674169/how-does-the-list-comprehension-to-flatten-a-python-list-work,How does the list comprehension to flatten a python list work? [duplicate],original
Mark Whitfield,"The second comprehension only works because item and sublist retain their final values from the first comprehension. Run that one first (or del item; del sublist then do it) and it will give a NameError as expected. The weirdness here is in Python's scoping rules, not in the comprehensions.","Sep 4, 2014 at 20:13",https://stackoverflow.com/questions/25674169/how-does-the-list-comprehension-to-flatten-a-python-list-work,How does the list comprehension to flatten a python list work? [duplicate],original
Bakuriu,@MarkWhitfield Only in python2... in python3 list-comprehensions behave as genexps and do not leak variables in the outer scope.,"Sep 4, 2014 at 20:14",https://stackoverflow.com/questions/25674169/how-does-the-list-comprehension-to-flatten-a-python-list-work,How does the list comprehension to flatten a python list work? [duplicate],original
jkokorian,"Thanks guys, now it makes complete sense!","Sep 4, 2014 at 20:17",https://stackoverflow.com/questions/25674169/how-does-the-list-comprehension-to-flatten-a-python-list-work,How does the list comprehension to flatten a python list work? [duplicate],original
Bakuriu,"Anyway the for are in order: you read from left-to-right and that is the order in which they are executed. The leftmost for is the outer loop, the rightmost for is the inner loop. When you translate a comprehension to an explicit loop you just add the colons between the for loops and you are done: [item for sublist in l for item in sublist] ""becomes"" for sublist in l: for item in sublist: item","Sep 4, 2014 at 20:18",https://stackoverflow.com/questions/25674169/how-does-the-list-comprehension-to-flatten-a-python-list-work,How does the list comprehension to flatten a python list work? [duplicate],original
Tomas Wilson,How does this answer the question?,"Dec 12, 2021 at 15:20",https://stackoverflow.com/questions/25674169/how-does-the-list-comprehension-to-flatten-a-python-list-work,How does the list comprehension to flatten a python list work? [duplicate],answer
Seraph,"Unfortunately, this solution doesn't work on a nested list that has an int as the first item in the list. For example, this code will not work on the following list: [10, 12, 36, [41, 59, 63], [77], 81, 93] . It raises the following error - TypeError: 'int' object is not iterable",Feb 27 at 12:09,https://stackoverflow.com/questions/25674169/how-does-the-list-comprehension-to-flatten-a-python-list-work,How does the list comprehension to flatten a python list work? [duplicate],answer
Jeppe,"@Seraph I think that's a separate issue. If the items in the list can have variable depths, it is probably not best solved with list-comprehensions. Recursive functions can solve that.",Oct 2 at 11:38,https://stackoverflow.com/questions/25674169/how-does-the-list-comprehension-to-flatten-a-python-list-work,How does the list comprehension to flatten a python list work? [duplicate],answer
mklbtz,"To do my profiling, I used a list containing 1000 sublists, each containing 100,000 integers. With this data, the execution time was roughly 3 times better using extend. Again, if all your sublists have only one element, the time should be roughly equivalent between the two approaches.","Aug 28, 2018 at 15:09",https://stackoverflow.com/questions/25674169/how-does-the-list-comprehension-to-flatten-a-python-list-work,How does the list comprehension to flatten a python list work? [duplicate],answer
mklbtz,"As an aside, I'm really surprised Python doesn't include implementations of flatten and iflatten that use these two approaches respectively. Seems like an oversight.","Aug 28, 2018 at 15:11",https://stackoverflow.com/questions/25674169/how-does-the-list-comprehension-to-flatten-a-python-list-work,How does the list comprehension to flatten a python list work? [duplicate],answer
Skylion,itertools.chain(*list) is essentially iflatten in practice.,Feb 1 at 17:26,https://stackoverflow.com/questions/25674169/how-does-the-list-comprehension-to-flatten-a-python-list-work,How does the list comprehension to flatten a python list work? [duplicate],answer
luk2302,sorted(set(raw_list)) should work and remove duplicates.,Aug 1 at 7:20,https://stackoverflow.com/questions/73190051/python-list-see-if-contains-consecutive-numbers-but-avoid-the-adjacent-next-dupl,Python list see if contains consecutive numbers but avoid the adjacent/next duplicate,original
luk2302,Does this answer your question? Removing duplicates in lists,Aug 1 at 7:21,https://stackoverflow.com/questions/73190051/python-list-see-if-contains-consecutive-numbers-but-avoid-the-adjacent-next-dupl,Python list see if contains consecutive numbers but avoid the adjacent/next duplicate,original
Charizard,"@luk2302 it has some pattern, which i need to keep it in mind.",Aug 1 at 7:22,https://stackoverflow.com/questions/73190051/python-list-see-if-contains-consecutive-numbers-but-avoid-the-adjacent-next-dupl,Python list see if contains consecutive numbers but avoid the adjacent/next duplicate,original
Charizard,"@luk2302 the upcoming element can be duplicate, will it satisfy this condition",Aug 1 at 7:23,https://stackoverflow.com/questions/73190051/python-list-see-if-contains-consecutive-numbers-but-avoid-the-adjacent-next-dupl,Python list see if contains consecutive numbers but avoid the adjacent/next duplicate,original
luk2302,"Then you a) would need to provide more examples and state clearly where your code fails for what reason, b) look at the linked post which talks about retaining order, and c) maybe do not sort the list in the first place!?",Aug 1 at 7:23,https://stackoverflow.com/questions/73190051/python-list-see-if-contains-consecutive-numbers-but-avoid-the-adjacent-next-dupl,Python list see if contains consecutive numbers but avoid the adjacent/next duplicate,original
John Gordon,Do you know what break does?,Aug 1 at 4:06,https://stackoverflow.com/questions/73188635/why-do-these-bits-of-code-not-work-the-same-python-list-comprehension-question,Why do these bits of code not work the same? (python list comprehension question),original
nikhil kumar,"Thank You @Andrej Kesely, thats exactly what I wanted.",Jul 31 at 8:58,https://stackoverflow.com/questions/73181535/converting-text-to-python-list,Converting text to python list,answer
nikhil kumar,thanks @Georgi count_item = [[] for _ in heading_list] with this I was to append as I wanted.,Jul 31 at 8:50,https://stackoverflow.com/questions/73181535/converting-text-to-python-list,Converting text to python list,answer
nikhil kumar,"Thanks @perpetual student, for suggesting this library. Can you help me after using this library How can I get the output as I wanted?",Jul 31 at 8:52,https://stackoverflow.com/questions/73181535/converting-text-to-python-list,Converting text to python list,answer
perpetualstudent,oh let me see...,Jul 31 at 8:54,https://stackoverflow.com/questions/73181535/converting-text-to-python-list,Converting text to python list,answer
Mr_and_Mrs_D,If your list is float32 tolist will convert it to floatss - that's not desired probably. Using list(myarray) doesn't suffer from this - why should we prefer tolist ?,"Jul 3, 2017 at 20:46",https://stackoverflow.com/questions/1966207/convert-numpy-array-to-python-list,Convert NumPy array to Python list,answer
Peter Hansen,"@Mr_and_Mrs_D are you suggesting that, despite having floats in your array, you'd like to have the resulting list be integers? That's sort of a whole different question... and of course you'd have to specify that despite being float32 values, they're all going to be integral. Anyway, if you had that situation, I guess doing myarray.astype(np.int32).tolist() would be an option, and explicit about what you're trying to accomplish. (And lastly, list(array_of_type_float32) doesn't give integers here when I tried it... so I don't know what you're asking.)","Jul 4, 2017 at 0:41",https://stackoverflow.com/questions/1966207/convert-numpy-array-to-python-list,Convert NumPy array to Python list,answer
Mr_and_Mrs_D,"I never mentioned integers - try float32_array = np.array([0.51764709], np.float32); print(float32_array.tolist()); print(list(float32_array))","Jul 4, 2017 at 7:54",https://stackoverflow.com/questions/1966207/convert-numpy-array-to-python-list,Convert NumPy array to Python list,answer
Peter Hansen,"Okay, so the one converts to [float] and the other uses the numpy scalar float32 type still, as [np.float32]. Fine. Good to know, but I guess whether it's desirable or not depends on each specific case. For what it's worth, I suspect that generally when someone (like the OP) asks for conversion to a list, they implicitly mean a list of regular Python data types, in this case either floats or integers, and not a list of numpy scalar types. Thanks for pointing this out: I've edited the answer to include a note about that.","Jul 4, 2017 at 15:21",https://stackoverflow.com/questions/1966207/convert-numpy-array-to-python-list,Convert NumPy array to Python list,answer
keithpjolley,"Along those lines: np.array([[0, 'one'], ['two', 3]]).tolist() -> [['0', 'one'], ['two', '3']]","Mar 20, 2019 at 19:58",https://stackoverflow.com/questions/1966207/convert-numpy-array-to-python-list,Convert NumPy array to Python list,answer
ClementWalter,"to get a flat list, there is also a.flatten().tolist() (or list(a.flatten()) cf discussion above)","Oct 26, 2020 at 15:52",https://stackoverflow.com/questions/1966207/convert-numpy-array-to-python-list,Convert NumPy array to Python list,answer
