RichieHindle,"There's an in-depth discussion of this here: rightfootin.blogspot.com/2006/09/more-on-python-flatten.html, discussing several methods of flattening arbitrarily nested lists of lists. An interesting read!","Jun 4, 2009 at 20:41",https://stackoverflow.com/questions/952914/how-do-i-make-a-flat-list-out-of-a-list-of-lists,How do I make a flat list out of a list of lists?,original
Golden Lion,stackoverflow.com/questions/50259290/… (this article explain the difference between an np.flatten() and a tf.flatten() use (static vs dynamic) ndarray.,"Dec 18, 2020 at 16:48",https://stackoverflow.com/questions/952914/how-do-i-make-a-flat-list-out-of-a-list-of-lists,How do I make a flat list out of a list of lists?,original
intuited,"I tried a test with the same data, using itertools.chain.from_iterable : $ python -mtimeit -s'from itertools import chain; l=[[1,2,3],[4,5,6], [7], [8,9]]*99' 'list(chain.from_iterable(l))'. It runs a bit more than twice as fast as the nested list comprehension that's the fastest of the alternatives shown here.","Oct 15, 2010 at 1:21",https://stackoverflow.com/questions/952914/how-do-i-make-a-flat-list-out-of-a-list-of-lists,How do I make a flat list out of a list of lists?,answer
Rob Crowell,I found the syntax hard to understand until I realized you can think of it exactly like nested for loops. for sublist in l: for item in sublist: yield item,"Jul 27, 2011 at 16:43",https://stackoverflow.com/questions/952914/how-do-i-make-a-flat-list-out-of-a-list-of-lists,How do I make a flat list out of a list of lists?,answer
John Mee,[leaf for tree in forest for leaf in tree] might be easier to comprehend and apply.,"Aug 29, 2013 at 1:38",https://stackoverflow.com/questions/952914/how-do-i-make-a-flat-list-out-of-a-list-of-lists,How do I make a flat list out of a list of lists?,answer
Sнаđошƒаӽ,"@RobCrowell Same here. To me the list comprehension one doesn't read right, something feels off about it - I always seem to get it wrong and end up googling. To me this reads right [leaf for leaf in tree for tree in forest]. I wish this is how it was. I am sure I am missing something about the grammar here, and I would appreciate if anyone could point that out.","Jul 12, 2021 at 17:19",https://stackoverflow.com/questions/952914/how-do-i-make-a-flat-list-out-of-a-list-of-lists,How do I make a flat list out of a list of lists?,answer
Gilthans,"I kept looking here every time I wanted to flatten a list, but this gif is what drove it home: i.stack.imgur.com/0GoV5.gif","Aug 11, 2021 at 12:04",https://stackoverflow.com/questions/952914/how-do-i-make-a-flat-list-out-of-a-list-of-lists,How do I make a flat list out of a list of lists?,answer
Tim Dierks,"The * is the tricky thing that makes chain less straightforward than the list comprehension. You have to know that chain only joins together the iterables passed as parameters, and the * causes the top-level list to be expanded into parameters, so chain joins together all those iterables, but doesn't descend further. I think this makes the comprehension more readable than the use of chain in this case.","Sep 3, 2014 at 14:13",https://stackoverflow.com/questions/952914/how-do-i-make-a-flat-list-out-of-a-list-of-lists,How do I make a flat list out of a list of lists?,answer
ShadowRanger,"@TimDierks: I'm not sure ""this requires you to understand Python syntax"" is an argument against using a given technique in Python. Sure, complex usage could confuse, but the ""splat"" operator is generally useful in many circumstances, and this isn't using it in a particularly obscure way; rejecting all language features that aren't necessarily obvious to beginning users means you're tying one hand behind your back. May as well throw out list comprehensions too while you're at it; users from other backgrounds would find a for loop that repeatedly appends more obvious.","Nov 12, 2015 at 20:26",https://stackoverflow.com/questions/952914/how-do-i-make-a-flat-list-out-of-a-list-of-lists,How do I make a flat list out of a list of lists?,answer
nadapez,* creates an intermediary tuple.! from_iterable fetch the nested lists directly from the top list.,"Oct 21, 2021 at 3:35",https://stackoverflow.com/questions/952914/how-do-i-make-a-flat-list-out-of-a-list-of-lists,How do I make a flat list out of a list of lists?,answer
Chris Collett,"To make this more readable, you can make a simple function: def flatten_list(deep_list: list[list[object]]): return list(chain.from_iterable(deep_list)). The type hinting improves the clarity of what's going on (modern IDEs would interpret this as returning a list[object] type).","Oct 25, 2021 at 14:34",https://stackoverflow.com/questions/952914/how-do-i-make-a-flat-list-out-of-a-list-of-lists,How do I make a flat list out of a list of lists?,answer
andrewrk,that's pretty neat and clever but I wouldn't use it because it's confusing to read.,"Jun 15, 2010 at 18:55",https://stackoverflow.com/questions/952914/how-do-i-make-a-flat-list-out-of-a-list-of-lists,How do I make a flat list out of a list of lists?,answer
Mike Graham,This is a Shlemiel the painter's algorithm joelonsoftware.com/articles/fog0000000319.html -- unnecessarily inefficient as well as unnecessarily ugly.,"Apr 25, 2012 at 18:24",https://stackoverflow.com/questions/952914/how-do-i-make-a-flat-list-out-of-a-list-of-lists,How do I make a flat list out of a list of lists?,answer
ulidtko,"The append operation on lists forms a Monoid, which is one of the most convenient abstractions for thinking of a + operation in a general sense (not limited to numbers only). So this answer deserves a +1 from me for (correct) treatment of lists as a monoid. The performance is concerning though...","Dec 3, 2014 at 10:35",https://stackoverflow.com/questions/952914/how-do-i-make-a-flat-list-out-of-a-list-of-lists,How do I make a flat list out of a list of lists?,answer
Jean-François Fabre,this is a very inefficient way because of the quadratic aspect of the sum.,"Jul 31, 2017 at 18:04",https://stackoverflow.com/questions/952914/how-do-i-make-a-flat-list-out-of-a-list-of-lists,How do I make a flat list out of a list of lists?,answer
ds4940,This article explains the maths of the inefficiency mathieularose.com/how-not-to-flatten-a-list-of-lists-in-python,"Jan 4, 2018 at 16:46",https://stackoverflow.com/questions/952914/how-do-i-make-a-flat-list-out-of-a-list-of-lists,How do I make a flat list out of a list of lists?,answer
Sara,"For huge nested lists,' list(numpy.array(a).flat)' is the fastest among all functions above.","Jan 20, 2019 at 13:57",https://stackoverflow.com/questions/952914/how-do-i-make-a-flat-list-out-of-a-list-of-lists,How do I make a flat list out of a list of lists?,answer
Leo,Is there a way to do a 3-d perfplot? number of arrays by average size of array?,"Apr 30, 2020 at 0:31",https://stackoverflow.com/questions/952914/how-do-i-make-a-flat-list-out-of-a-list-of-lists,How do I make a flat list out of a list of lists?,answer
Boris Verkhovskiy,"@Sara can you define ""huge"" please?","Nov 14, 2020 at 6:05",https://stackoverflow.com/questions/952914/how-do-i-make-a-flat-list-out-of-a-list-of-lists,How do I make a flat list out of a list of lists?,answer
mirekphd,"Tried numpy_flat on the test example from Rossetta Code (link) and got VisibleDeprecationWarning: Creating an ndarray from ragged nested sequences (which is a list-or-tuple of lists-or-tuples-or ndarrays with different lengths or shapes) is deprecated. If you meant to do this, you must specify 'dtype=object' when creating the ndarray","Dec 5, 2020 at 11:08",https://stackoverflow.com/questions/952914/how-do-i-make-a-flat-list-out-of-a-list-of-lists,How do I make a flat list out of a list of lists?,answer
Oscar Benjamin,One option missed above which shows up faster for my particular case i just items = []; for sublist in a: items.extend(sublist); return sublist,"Oct 11, 2021 at 17:05",https://stackoverflow.com/questions/952914/how-do-i-make-a-flat-list-out-of-a-list-of-lists,How do I make a flat list out of a list of lists?,answer
Mike Graham,This is a Shlemiel the painter's algorithm joelonsoftware.com/articles/fog0000000319.html,"Apr 25, 2012 at 18:26",https://stackoverflow.com/questions/952914/how-do-i-make-a-flat-list-out-of-a-list-of-lists,How do I make a flat list out of a list of lists?,answer
gntskn,"reduce is very inefficient for this use case as it will repeat copies and generate many unused temporary lists (O(n^2) in both time and possibly space, depending on how the GC decides to clean). It's better to use append or extend.","Oct 2, 2020 at 17:00",https://stackoverflow.com/questions/952914/how-do-i-make-a-flat-list-out-of-a-list-of-lists,How do I make a flat list out of a list of lists?,answer
Martin Thoma,"I just wrote pretty much the same, because I didn't see your solution ... here is what I looked for ""recursively flatten complete multiple lists"" ... (+1)","Mar 25, 2017 at 15:32",https://stackoverflow.com/questions/952914/how-do-i-make-a-flat-list-out-of-a-list-of-lists,How do I make a flat list out of a list of lists?,answer
pylang,"@MartinThoma Much appreciated. FYI, if flattening nested iterables is a common practice for you, there are some third-party packages that handle this well. This may save from reinventing the wheel. I've mentioned more_itertools among others discussed in this post. Cheers.","Mar 25, 2017 at 17:51",https://stackoverflow.com/questions/952914/how-do-i-make-a-flat-list-out-of-a-list-of-lists,How do I make a flat list out of a list of lists?,answer
Wolf,"Maybe traverse could also be a good name for this way of a tree, whereas I'd keep it less universal for this answer by sticking to nested lists.","Jun 15, 2017 at 10:22",https://stackoverflow.com/questions/952914/how-do-i-make-a-flat-list-out-of-a-list-of-lists,How do I make a flat list out of a list of lists?,answer
Ryan Allen,"You can check if hasattr(x, '__iter__') instead of importing/checking against Iterable and that will exclude strings as well.","Apr 30, 2018 at 16:46",https://stackoverflow.com/questions/952914/how-do-i-make-a-flat-list-out-of-a-list-of-lists,How do I make a flat list out of a list of lists?,answer
sunnyX,"the above code doesnt seem to work for if one of the nested lists is having a list of strings. [1, 2, [3, 4], [4], [], 9, 9.5, 'ssssss', ['str', 'sss', 'ss'], [3, 4, 5]] output:- [1, 2, 3, 4, 4, 9, 9.5, 'ssssss', 3, 4, 5]","Jun 12, 2019 at 21:35",https://stackoverflow.com/questions/952914/how-do-i-make-a-flat-list-out-of-a-list-of-lists,How do I make a flat list out of a list of lists?,answer
kylebebak,OP doesn't mention they want to use numpy. Python has good ways of doing this without relying on a library,"Oct 3, 2021 at 1:01",https://stackoverflow.com/questions/952914/how-do-i-make-a-flat-list-out-of-a-list-of-lists,How do I make a flat list out of a list of lists?,answer
viddik13,If you can afford adding a package to your project - this answer is best,"Mar 5, 2020 at 15:53",https://stackoverflow.com/questions/952914/how-do-i-make-a-flat-list-out-of-a-list-of-lists,How do I make a flat list out of a list of lists?,answer
Sajad.sni,"it fails when all elements are not list. (e.g. lst=[1, [2,3]]). of course integer is not iterable.","Sep 8, 2020 at 8:32",https://stackoverflow.com/questions/952914/how-do-i-make-a-flat-list-out-of-a-list-of-lists,How do I make a flat list out of a list of lists?,answer
viddik13,"also, mind that list of strings will be flattened to a list of characters","Oct 30, 2020 at 2:05",https://stackoverflow.com/questions/952914/how-do-i-make-a-flat-list-out-of-a-list-of-lists,How do I make a flat list out of a list of lists?,answer
agf,"extend is better used as newlist = [], extend = newlist.extend, for sublist in l: extend(l) as it avoids the (rather large) overhead of the lambda, the attribute lookup on x, and the or.","Sep 24, 2011 at 10:12",https://stackoverflow.com/questions/952914/how-do-i-make-a-flat-list-out-of-a-list-of-lists,How do I make a flat list out of a list of lists?,answer
Markus Dutschke,for python 3 add from functools import reduce,"Jul 2, 2019 at 12:24",https://stackoverflow.com/questions/952914/how-do-i-make-a-flat-list-out-of-a-list-of-lists,How do I make a flat list out of a list of lists?,answer
Uriya Harpeness,This answer is already up in this question: stackoverflow.com/a/952946/14273548,"Dec 9, 2021 at 9:24",https://stackoverflow.com/questions/952914/how-do-i-make-a-flat-list-out-of-a-list-of-lists,How do I make a flat list out of a list of lists?,answer
Arel,"Neat! Though the other answer here, stackoverflow.com/a/952946/14273548, explains the reasons this solution should generally be avoided (it's inefficient and confusing.)","Dec 29, 2021 at 20:29",https://stackoverflow.com/questions/952914/how-do-i-make-a-flat-list-out-of-a-list-of-lists,How do I make a flat list out of a list of lists?,answer
Culpepper,Will also give a TypeError if your list contains a tuple,Jan 31 at 18:42,https://stackoverflow.com/questions/952914/how-do-i-make-a-flat-list-out-of-a-list-of-lists,How do I make a flat list out of a list of lists?,answer
juanpa.arrivillaga,why would you use a tuple? now your solution is inefficient.,"Jul 31, 2021 at 18:53",https://stackoverflow.com/questions/952914/how-do-i-make-a-flat-list-out-of-a-list-of-lists,How do I make a flat list out of a list of lists?,answer
juanpa.arrivillaga,"And with any sequence, sum((flatten(e) for e in itr), tuple()) is highly inefficient,","Jul 31, 2021 at 18:53",https://stackoverflow.com/questions/952914/how-do-i-make-a-flat-list-out-of-a-list-of-lists,How do I make a flat list out of a list of lists?,answer
mmj,"@juanpa.arrivillaga Your comment made me think about improving my answer and I think I found a better one, what do you think?","Aug 1, 2021 at 17:37",https://stackoverflow.com/questions/952914/how-do-i-make-a-flat-list-out-of-a-list-of-lists,How do I make a flat list out of a list of lists?,answer
EL_DON,"Doesn't work for unevenly nested lists like [1, 2, [3], [[4]], [5, [6]]]","Apr 22, 2019 at 21:39",https://stackoverflow.com/questions/952914/how-do-i-make-a-flat-list-out-of-a-list-of-lists,How do I make a flat list out of a list of lists?,answer
EL_DON,"@juanpa.arrivillaga it's a simple and natural extension of the question, though. Answers that can handle greater depth of nesting are more likely to be useful to someone who finds this question.","Aug 2, 2021 at 19:53",https://stackoverflow.com/questions/952914/how-do-i-make-a-flat-list-out-of-a-list-of-lists,How do I make a flat list out of a list of lists?,answer
pylang,"If you are still interested in Python 2 compatibility, change yield from to a for loop, e.g. for x in flatten(i): yield x","Jun 19, 2018 at 19:06",https://stackoverflow.com/questions/952914/how-do-i-make-a-flat-list-out-of-a-list-of-lists,How do I make a flat list out of a list of lists?,answer
EL_DON,"Fails for python2.7 for the example nested list in the question: [[1, 2, 3], [4, 5, 6], [7], [8, 9]]","Apr 22, 2019 at 21:34",https://stackoverflow.com/questions/952914/how-do-i-make-a-flat-list-out-of-a-list-of-lists,How do I make a flat list out of a list of lists?,answer
Maciek,Why extend([l]) instead of append(l)?,"Apr 9, 2020 at 18:31",https://stackoverflow.com/questions/952914/how-do-i-make-a-flat-list-out-of-a-list-of-lists,How do I make a flat list out of a list of lists?,answer
Darkonaut,"That's just a more complicated and a bit slower way of what ᴡʜᴀᴄᴋᴀᴍᴀᴅᴏᴏᴅʟᴇ3000 already posted before. I reinvented his proposal yesterday, so this approach seems quite popular these days ;)","Jan 10, 2018 at 22:03",https://stackoverflow.com/questions/952914/how-do-i-make-a-flat-list-out-of-a-list-of-lists,How do I make a flat list out of a list of lists?,answer
tharndt,"Not quite: wierd_list = [[1, 2, 3], [4, 5, 6], [7], [8, 9], 10] >> nice_list=[1, 2, 3, 4, 5, 6, 7, 8, 9, 1, 0]","Jan 11, 2018 at 8:17",https://stackoverflow.com/questions/952914/how-do-i-make-a-flat-list-out-of-a-list-of-lists,How do I make a flat list out of a list of lists?,answer
tharndt,"my code as one liner would be : flat_list = [int(e.replace('[','').replace(']','')) for e in str(deep_list).split(',')]","Jan 11, 2018 at 8:32",https://stackoverflow.com/questions/952914/how-do-i-make-a-flat-list-out-of-a-list-of-lists,How do I make a flat list out of a list of lists?,answer
Darkonaut,"You are indeed right +1, ᴡʜᴀᴄᴋᴀᴍᴀᴅᴏᴏᴅʟᴇ3000's proposal won't work with multiple digit numbers, I also didn't test this before although it should be obvious. You could simplify your code and write [int(e.strip('[ ]')) for e in str(deep_list).split(',')]. But I'd suggest to stick with Deleet's proposal for real use cases. It doesn't contain hacky type transformations, it's faster and more versatile because it naturally also handles lists with mixed types.","Jan 11, 2018 at 16:31",https://stackoverflow.com/questions/952914/how-do-i-make-a-flat-list-out-of-a-list-of-lists,How do I make a flat list out of a list of lists?,answer
tharndt,Unfortunately no. But I saw this code recently here: Python Practice Book 6.1.2,"Jan 15, 2018 at 8:18",https://stackoverflow.com/questions/952914/how-do-i-make-a-flat-list-out-of-a-list-of-lists,How do I make a flat list out of a list of lists?,answer
Mark Ransom,What is the input you use to demonstrate this problem?,1 hour ago,https://stackoverflow.com/questions/74209069/python-list-doesnt-work-with-double-digits,Python list doesn't work with double digits,original
Tom Karzes,"numPhrase is a single string, not a list of strings. When you use it as an iterator, you get each individual character in the string. If you want a list of words, use numPhrase.split() instead. That will solve your problem.",1 hour ago,https://stackoverflow.com/questions/74209069/python-list-doesnt-work-with-double-digits,Python list doesn't work with double digits,original
elite.dragon,Yeah that fixed it thanks so much!,1 hour ago,https://stackoverflow.com/questions/74209069/python-list-doesnt-work-with-double-digits,Python list doesn't work with double digits,original
buran,"You take a string as input, then you iterate over it char by char, how do you expect that single char would match a key in the dict?",1 hour ago,https://stackoverflow.com/questions/74209069/python-list-doesnt-work-with-double-digits,Python list doesn't work with double digits,original
Deepak Tripathi,Instead use list_comprehension and convert to set to remove duplicates ?,8 hours ago,https://stackoverflow.com/questions/74203814/remove-similar-strings-in-python-list-by-levenshtein-ratio,Remove similar Strings in Python List by Levenshtein Ratio,original
toyota Supra,@schieslu. Typo error: for x in word list: Should be for x in word_list:. Missed underscore,6 hours ago,https://stackoverflow.com/questions/74203814/remove-similar-strings-in-python-list-by-levenshtein-ratio,Remove similar Strings in Python List by Levenshtein Ratio,original
toyota Supra,Typo error: for x in word list: Should be for x in word_list:. Missed underscore,6 hours ago,https://stackoverflow.com/questions/74203814/remove-similar-strings-in-python-list-by-levenshtein-ratio,Remove similar Strings in Python List by Levenshtein Ratio,answer
James,Oh! Thank you so much! Sorry if the question seemed redundant.,yesterday,https://stackoverflow.com/questions/74195907/python-list-of-functions-without-executing,Python List of Functions without Executing,answer
CrazyChucky,You point it out in your title—you're missing self in your definition. (Is there a reason to not simply write job_status such that it takes a variable number of arguments with *?),Oct 19 at 22:07,https://stackoverflow.com/questions/74132364/python-list-comprehension-as-a-decorator-including-self,Python - list comprehension as a decorator (including self),original
Barmar,"A decorator is generally only useful if it will be used to modify different functions. If this is just for a specific function, there's not much point in it -- just put the code in that function.",Oct 19 at 22:09,https://stackoverflow.com/questions/74132364/python-list-comprehension-as-a-decorator-including-self,Python - list comprehension as a decorator (including self),original
marcin2x4,I would need physical examples as I'm not sure how to combine both functions into one. Challenge is how to perform the comprehension inside job_status,Oct 19 at 22:16,https://stackoverflow.com/questions/74132364/python-list-comprehension-as-a-decorator-including-self,Python - list comprehension as a decorator (including self),original
juanpa.arrivillaga,"you want something like def inner(self, live_of_val): return [func(self, value) for value in list_of_val] but I see no reason to do things this way. Why don't you just define job_status to work this way? It's very unexpected behavior",Oct 19 at 22:24,https://stackoverflow.com/questions/74132364/python-list-comprehension-as-a-decorator-including-self,Python - list comprehension as a decorator (including self),original
juanpa.arrivillaga,"Also, pass_by_list_comprehension should not be a method, but just a function in the module. And pass_by_list_comprehension doesn't really make sense as a name...",Oct 19 at 22:26,https://stackoverflow.com/questions/74132364/python-list-comprehension-as-a-decorator-including-self,Python - list comprehension as a decorator (including self),original
CrazyChucky,"Did you mean to use Callable as a type hint for func, after you import it?",Oct 19 at 22:33,https://stackoverflow.com/questions/74132364/python-list-comprehension-as-a-decorator-including-self,Python - list comprehension as a decorator (including self),answer
marcin2x4,This is a pretty one-liner solution. I think that decorator would always be a good practice but in my scenario I agree it would be an overkill. Thanks for the other suggestions as well.,Oct 19 at 23:02,https://stackoverflow.com/questions/74132364/python-list-comprehension-as-a-decorator-including-self,Python - list comprehension as a decorator (including self),answer
CrazyChucky,"Good practice with decorators is to usually leave the function signature (that is, what parameters it takes) unchanged, unless you have a really good reason for doing otherwise.",Oct 19 at 23:16,https://stackoverflow.com/questions/74132364/python-list-comprehension-as-a-decorator-including-self,Python - list comprehension as a decorator (including self),answer
Julien,How would we know it's more elegant without what you have done as reference? How to Ask and minimal reproducible example,2 days ago,https://stackoverflow.com/questions/74176549/divide-a-python-list-to-sub-lists-by-condition,Divide a python list to sub lists by condition [closed],original
Rahul K P,Please post your code as text.,Oct 21 at 22:25,https://stackoverflow.com/questions/74159679/python-list-index-not-in-order,Python list index not in order,original
rv.kvetch,seeing code as image makes it harder to copy paste and also to test,Oct 21 at 22:25,https://stackoverflow.com/questions/74159679/python-list-index-not-in-order,Python list index not in order,original
Tim Roberts,"index is very much the wrong tool for this job. Remember, index returns the FIRST occurrence of the character. If you have three Ls, it will return the same one each time. You need to have your loop go by indexes.",Oct 21 at 22:27,https://stackoverflow.com/questions/74159679/python-list-index-not-in-order,Python list index not in order,original
Daniel Hao,"Consider to use List Comp like this - ans = [ch.upper() if not idx%2 else ch.lower() for idx, ch in enumerate(word)]",Oct 21 at 22:40,https://stackoverflow.com/questions/74159679/python-list-index-not-in-order,Python list index not in order,original
trincot,Python has a native len function.,2 days ago,https://stackoverflow.com/questions/74174171/how-do-i-find-countries-where-the-name-has-between-4-and-5-letters-with-regex-in,How do I find countries where the name has between 4 and 5 letters with regex in python list?,original
knittl,"Why range(4,5) and not [4,5]?",2 days ago,https://stackoverflow.com/questions/74174171/how-do-i-find-countries-where-the-name-has-between-4-and-5-letters-with-regex-in,How do I find countries where the name has between 4 and 5 letters with regex in python list?,answer
I'mahdi,"@knittl, here you're right [4,5] is better, But how about range(4,40) or [4,5,6,...37,38,39] which is better, use range or use hard coding with list?",2 days ago,https://stackoverflow.com/questions/74174171/how-do-i-find-countries-where-the-name-has-between-4-and-5-letters-with-regex-in,How do I find countries where the name has between 4 and 5 letters with regex in python list?,answer
knittl,I'd probably go for len >= 4 and len <= 40 :),2 days ago,https://stackoverflow.com/questions/74174171/how-do-i-find-countries-where-the-name-has-between-4-and-5-letters-with-regex-in,How do I find countries where the name has between 4 and 5 letters with regex in python list?,answer
I'mahdi,"@knittl, OK but I prefer to short this : len >= 4 and len <= 40 to len in range(4, 41) ;)",2 days ago,https://stackoverflow.com/questions/74174171/how-do-i-find-countries-where-the-name-has-between-4-and-5-letters-with-regex-in,How do I find countries where the name has between 4 and 5 letters with regex in python list?,answer
knittl,"Thanks for fixing the off-by-one error with range(4,5), which would only contain 4 :)",2 days ago,https://stackoverflow.com/questions/74174171/how-do-i-find-countries-where-the-name-has-between-4-and-5-letters-with-regex-in,How do I find countries where the name has between 4 and 5 letters with regex in python list?,answer
Deepak Tripathi,for last element in your alphabet list i.e z your code is breaking because you are trying to fetch at alphabet[location_ofz+ 1] which will be more than index in your list.,Oct 23 at 4:34,https://stackoverflow.com/questions/74168662/python-list-index-is-out-of-range,python list index is out of range,original
