gntskn,"reduce is very inefficient for this use case as it will repeat copies and generate many unused temporary lists (O(n^2) in both time and possibly space, depending on how the GC decides to clean). It's better to use append or extend.","Oct 2, 2020 at 17:00",https://stackoverflow.com/questions/952914/how-do-i-make-a-flat-list-out-of-a-list-of-lists,How do I make a flat list out of a list of lists?,answer
Martin Thoma,"I just wrote pretty much the same, because I didn't see your solution ... here is what I looked for ""recursively flatten complete multiple lists"" ... (+1)","Mar 25, 2017 at 15:32",https://stackoverflow.com/questions/952914/how-do-i-make-a-flat-list-out-of-a-list-of-lists,How do I make a flat list out of a list of lists?,answer
pylang,"@MartinThoma Much appreciated. FYI, if flattening nested iterables is a common practice for you, there are some third-party packages that handle this well. This may save from reinventing the wheel. I've mentioned more_itertools among others discussed in this post. Cheers.","Mar 25, 2017 at 17:51",https://stackoverflow.com/questions/952914/how-do-i-make-a-flat-list-out-of-a-list-of-lists,How do I make a flat list out of a list of lists?,answer
Wolf,"Maybe traverse could also be a good name for this way of a tree, whereas I'd keep it less universal for this answer by sticking to nested lists.","Jun 15, 2017 at 10:22",https://stackoverflow.com/questions/952914/how-do-i-make-a-flat-list-out-of-a-list-of-lists,How do I make a flat list out of a list of lists?,answer
Ryan Allen,"You can check if hasattr(x, '__iter__') instead of importing/checking against Iterable and that will exclude strings as well.","Apr 30, 2018 at 16:46",https://stackoverflow.com/questions/952914/how-do-i-make-a-flat-list-out-of-a-list-of-lists,How do I make a flat list out of a list of lists?,answer
sunnyX,"the above code doesnt seem to work for if one of the nested lists is having a list of strings. [1, 2, [3, 4], [4], [], 9, 9.5, 'ssssss', ['str', 'sss', 'ss'], [3, 4, 5]] output:- [1, 2, 3, 4, 4, 9, 9.5, 'ssssss', 3, 4, 5]","Jun 12, 2019 at 21:35",https://stackoverflow.com/questions/952914/how-do-i-make-a-flat-list-out-of-a-list-of-lists,How do I make a flat list out of a list of lists?,answer
kylebebak,OP doesn't mention they want to use numpy. Python has good ways of doing this without relying on a library,"Oct 3, 2021 at 1:01",https://stackoverflow.com/questions/952914/how-do-i-make-a-flat-list-out-of-a-list-of-lists,How do I make a flat list out of a list of lists?,answer
viddik13,If you can afford adding a package to your project - this answer is best,"Mar 5, 2020 at 15:53",https://stackoverflow.com/questions/952914/how-do-i-make-a-flat-list-out-of-a-list-of-lists,How do I make a flat list out of a list of lists?,answer
Sajad.sni,"it fails when all elements are not list. (e.g. lst=[1, [2,3]]). of course integer is not iterable.","Sep 8, 2020 at 8:32",https://stackoverflow.com/questions/952914/how-do-i-make-a-flat-list-out-of-a-list-of-lists,How do I make a flat list out of a list of lists?,answer
viddik13,"also, mind that list of strings will be flattened to a list of characters","Oct 30, 2020 at 2:05",https://stackoverflow.com/questions/952914/how-do-i-make-a-flat-list-out-of-a-list-of-lists,How do I make a flat list out of a list of lists?,answer
agf,"extend is better used as newlist = [], extend = newlist.extend, for sublist in l: extend(l) as it avoids the (rather large) overhead of the lambda, the attribute lookup on x, and the or.","Sep 24, 2011 at 10:12",https://stackoverflow.com/questions/952914/how-do-i-make-a-flat-list-out-of-a-list-of-lists,How do I make a flat list out of a list of lists?,answer
Markus Dutschke,for python 3 add from functools import reduce,"Jul 2, 2019 at 12:24",https://stackoverflow.com/questions/952914/how-do-i-make-a-flat-list-out-of-a-list-of-lists,How do I make a flat list out of a list of lists?,answer
Uriya Harpeness,This answer is already up in this question: stackoverflow.com/a/952946/14273548,"Dec 9, 2021 at 9:24",https://stackoverflow.com/questions/952914/how-do-i-make-a-flat-list-out-of-a-list-of-lists,How do I make a flat list out of a list of lists?,answer
Arel,"Neat! Though the other answer here, stackoverflow.com/a/952946/14273548, explains the reasons this solution should generally be avoided (it's inefficient and confusing.)","Dec 29, 2021 at 20:29",https://stackoverflow.com/questions/952914/how-do-i-make-a-flat-list-out-of-a-list-of-lists,How do I make a flat list out of a list of lists?,answer
Culpepper,Will also give a TypeError if your list contains a tuple,Jan 31 at 18:42,https://stackoverflow.com/questions/952914/how-do-i-make-a-flat-list-out-of-a-list-of-lists,How do I make a flat list out of a list of lists?,answer
juanpa.arrivillaga,why would you use a tuple? now your solution is inefficient.,"Jul 31, 2021 at 18:53",https://stackoverflow.com/questions/952914/how-do-i-make-a-flat-list-out-of-a-list-of-lists,How do I make a flat list out of a list of lists?,answer
juanpa.arrivillaga,"And with any sequence, sum((flatten(e) for e in itr), tuple()) is highly inefficient,","Jul 31, 2021 at 18:53",https://stackoverflow.com/questions/952914/how-do-i-make-a-flat-list-out-of-a-list-of-lists,How do I make a flat list out of a list of lists?,answer
mmj,"@juanpa.arrivillaga Your comment made me think about improving my answer and I think I found a better one, what do you think?","Aug 1, 2021 at 17:37",https://stackoverflow.com/questions/952914/how-do-i-make-a-flat-list-out-of-a-list-of-lists,How do I make a flat list out of a list of lists?,answer
EL_DON,"Doesn't work for unevenly nested lists like [1, 2, [3], [[4]], [5, [6]]]","Apr 22, 2019 at 21:39",https://stackoverflow.com/questions/952914/how-do-i-make-a-flat-list-out-of-a-list-of-lists,How do I make a flat list out of a list of lists?,answer
EL_DON,"@juanpa.arrivillaga it's a simple and natural extension of the question, though. Answers that can handle greater depth of nesting are more likely to be useful to someone who finds this question.","Aug 2, 2021 at 19:53",https://stackoverflow.com/questions/952914/how-do-i-make-a-flat-list-out-of-a-list-of-lists,How do I make a flat list out of a list of lists?,answer
pylang,"If you are still interested in Python 2 compatibility, change yield from to a for loop, e.g. for x in flatten(i): yield x","Jun 19, 2018 at 19:06",https://stackoverflow.com/questions/952914/how-do-i-make-a-flat-list-out-of-a-list-of-lists,How do I make a flat list out of a list of lists?,answer
EL_DON,"Fails for python2.7 for the example nested list in the question: [[1, 2, 3], [4, 5, 6], [7], [8, 9]]","Apr 22, 2019 at 21:34",https://stackoverflow.com/questions/952914/how-do-i-make-a-flat-list-out-of-a-list-of-lists,How do I make a flat list out of a list of lists?,answer
Maciek,Why extend([l]) instead of append(l)?,"Apr 9, 2020 at 18:31",https://stackoverflow.com/questions/952914/how-do-i-make-a-flat-list-out-of-a-list-of-lists,How do I make a flat list out of a list of lists?,answer
Darkonaut,"That's just a more complicated and a bit slower way of what ᴡʜᴀᴄᴋᴀᴍᴀᴅᴏᴏᴅʟᴇ3000 already posted before. I reinvented his proposal yesterday, so this approach seems quite popular these days ;)","Jan 10, 2018 at 22:03",https://stackoverflow.com/questions/952914/how-do-i-make-a-flat-list-out-of-a-list-of-lists,How do I make a flat list out of a list of lists?,answer
tharndt,"Not quite: wierd_list = [[1, 2, 3], [4, 5, 6], [7], [8, 9], 10] >> nice_list=[1, 2, 3, 4, 5, 6, 7, 8, 9, 1, 0]","Jan 11, 2018 at 8:17",https://stackoverflow.com/questions/952914/how-do-i-make-a-flat-list-out-of-a-list-of-lists,How do I make a flat list out of a list of lists?,answer
tharndt,"my code as one liner would be : flat_list = [int(e.replace('[','').replace(']','')) for e in str(deep_list).split(',')]","Jan 11, 2018 at 8:32",https://stackoverflow.com/questions/952914/how-do-i-make-a-flat-list-out-of-a-list-of-lists,How do I make a flat list out of a list of lists?,answer
Darkonaut,"You are indeed right +1, ᴡʜᴀᴄᴋᴀᴍᴀᴅᴏᴏᴅʟᴇ3000's proposal won't work with multiple digit numbers, I also didn't test this before although it should be obvious. You could simplify your code and write [int(e.strip('[ ]')) for e in str(deep_list).split(',')]. But I'd suggest to stick with Deleet's proposal for real use cases. It doesn't contain hacky type transformations, it's faster and more versatile because it naturally also handles lists with mixed types.","Jan 11, 2018 at 16:31",https://stackoverflow.com/questions/952914/how-do-i-make-a-flat-list-out-of-a-list-of-lists,How do I make a flat list out of a list of lists?,answer
tharndt,Unfortunately no. But I saw this code recently here: Python Practice Book 6.1.2,"Jan 15, 2018 at 8:18",https://stackoverflow.com/questions/952914/how-do-i-make-a-flat-list-out-of-a-list-of-lists,How do I make a flat list out of a list of lists?,answer
saro,"Tx, its a usable answer. However if possible i want to do it with xml etree.",Sep 14 at 19:07,https://stackoverflow.com/questions/73720445/parse-xml-file-to-a-python-list,Parse xml file to a python list,answer
Wael Jlassi,PS ; i will update it to be list of tuples as u aasked,Sep 14 at 16:56,https://stackoverflow.com/questions/73720445/parse-xml-file-to-a-python-list,Parse xml file to a python list,answer
Wael Jlassi,as @JohnFrum said u shave to fix that file strucuture,Sep 14 at 17:02,https://stackoverflow.com/questions/73720445/parse-xml-file-to-a-python-list,Parse xml file to a python list,answer
Mechanic Pig,"[a[:i:-1] for i in range(-len(a) - 1, -1)]",Sep 14 at 16:31,https://stackoverflow.com/questions/73720308/how-to-reverse-slice-python-list,how to reverse slice python list,original
Mechanic Pig,This is different from the expected output of OP.,Sep 14 at 16:38,https://stackoverflow.com/questions/73720308/how-to-reverse-slice-python-list,how to reverse slice python list,answer
Devesh Kumar Singh,What's the expected output? globalTags + chargeTags ?,"Jun 27, 2019 at 7:39",https://stackoverflow.com/questions/56786232/python-list-join-via-map-yields-none-type-list,"Python list join via Map() yields ""None type"" list [duplicate]",original
user10417531,".append() doesn't return anything, it modifies the list in place.","Jun 27, 2019 at 7:40",https://stackoverflow.com/questions/56786232/python-list-join-via-map-yields-none-type-list,"Python list join via Map() yields ""None type"" list [duplicate]",original
juanpa.arrivillaga,What do you think .append returns? You should never use map for side effects,"Jun 27, 2019 at 7:40",https://stackoverflow.com/questions/56786232/python-list-join-via-map-yields-none-type-list,"Python list join via Map() yields ""None type"" list [duplicate]",original
khelwood,You don't need those backslashes.,"Jun 27, 2019 at 7:51",https://stackoverflow.com/questions/56786232/python-list-join-via-map-yields-none-type-list,"Python list join via Map() yields ""None type"" list [duplicate]",original
ggorlen,"append doesn't return anything useful, just None. It modifies the list in place. You probably want to declare that list outside of the loop, otherwise you're making a new list and putting 1 element in it on each iteration, only to overwrite it on the next iteration. amenities_extras = ... also overwrites the list that's being looped over. Or just use [x.text for x in amenities_extras].","Jul 2, 2021 at 4:50",https://stackoverflow.com/questions/68219743/why-python-list-append-not-working-in-my-code,why python list append not working in my code? [duplicate],original
shree.pat18,append does not return a value.,"Jul 2, 2021 at 4:50",https://stackoverflow.com/questions/68219743/why-python-list-append-not-working-in-my-code,why python list append not working in my code? [duplicate],original
Tim Roberts,"You are emptying the list every time through the loop. And since amenities_extras already contains the list, what are you really trying to do here?","Jul 2, 2021 at 4:51",https://stackoverflow.com/questions/68219743/why-python-list-append-not-working-in-my-code,why python list append not working in my code? [duplicate],original
boyenec,Thanks all...the problem was my list in inside for loop.,"Jul 2, 2021 at 5:17",https://stackoverflow.com/questions/68219743/why-python-list-append-not-working-in-my-code,why python list append not working in my code? [duplicate],original
Marek R,BTW this amenities_extras = i.text in beginning of loop is very confusing since you iterate over amenities_extras it is not clear what was your intent. It would be better to avoid such variable smashing.,Sep 14 at 15:48,https://stackoverflow.com/questions/68219743/why-python-list-append-not-working-in-my-code,why python list append not working in my code? [duplicate],original
juanpa.arrivillaga,"amenities_extras_list[i] nope, that won't work. You'd need i to be the zerod count of the iteration, e.g. using enumerate, but instead, you can just do amenities_extras_list[-1]","Jul 2, 2021 at 4:54",https://stackoverflow.com/questions/68219743/why-python-list-append-not-working-in-my-code,why python list append not working in my code? [duplicate],answer
FaranAiki,"Wait, I forgot that i is not an integer....","Jul 2, 2021 at 4:55",https://stackoverflow.com/questions/68219743/why-python-list-append-not-working-in-my-code,why python list append not working in my code? [duplicate],answer
lvc,possible duplicate of why does python's list.append evaluate to false?,"Jun 26, 2012 at 11:26",https://stackoverflow.com/questions/49495100/python-list-append-and-extend-gives-me-a-none-i-want-them-to-be-an-appended-and,"Why do these list operations (methods: clear / extend / reverse / append / sort / remove) return None, rather than the resulting list?",original
Karl Knechtel,See also: Why does not the + operator change a list while .append() does?,Aug 12 at 23:54,https://stackoverflow.com/questions/49495100/python-list-append-and-extend-gives-me-a-none-i-want-them-to-be-an-appended-and,"Why do these list operations (methods: clear / extend / reverse / append / sort / remove) return None, rather than the resulting list?",original
Nathaniel Jones,"""pstat slipped through my filter when it was weak."" I love it. pstats remains to this day as the one that got away: stats.strip_dirs().add() => <pstats.Stats object at 0x0000018866977640>","Aug 3, 2021 at 20:22",https://stackoverflow.com/questions/49495100/python-list-append-and-extend-gives-me-a-none-i-want-them-to-be-an-appended-and,"Why do these list operations (methods: clear / extend / reverse / append / sort / remove) return None, rather than the resulting list?",answer
scubbo,"Coming back to this ten years after it was written (thanks for the excellent illustrative edit, @Karl Knechtel!), Guido's response to that paradigm is, indeed, reasonable. However, having fallen in love with FP over that time, I feel like it's a strawman - if no methods mutate an object in-place but always return a new object, then the code being chained could instead be expressed by: x1 = x.compress(); x2=x1.chop(y); x3 = x2.sort(z) - which, I claim, is much more intuitively replaced with a chain. That said - Python isn't FP (mostly? intentionally?), so paradigm doesn't apply.",Aug 4 at 4:32,https://stackoverflow.com/questions/49495100/python-list-append-and-extend-gives-me-a-none-i-want-them-to-be-an-appended-and,"Why do these list operations (methods: clear / extend / reverse / append / sort / remove) return None, rather than the resulting list?",answer
scubbo,"This is obviously a mindset that I need to aim to cultivate, because my initial reaction to ""...so why return it again?"" was ""why not?"". To my mind, returning a reference allows a different technique (""chaining"") without preventing any other technique (sequential modifications), so it would only be ""worse"" if chaining itself is ""bad"". However, arguments put forward in other comments (by Guido himself, no less!) assert that chaining is, indeed, bad. Thank you for your input! I really enjoying learning from people who know what they're talking about!","Jun 26, 2012 at 11:38",https://stackoverflow.com/questions/49495100/python-list-append-and-extend-gives-me-a-none-i-want-them-to-be-an-appended-and,"Why do these list operations (methods: clear / extend / reverse / append / sort / remove) return None, rather than the resulting list?",answer
Tim Pietzcker,"@scubbo: The Zen of Python (import this) states that ""There should be one-- and preferably only one --obvious way to do it.""; this helps answering the ""Why not?"" a little bit. Although I must admit that there are several areas in Python where ""There's more than one way to do it."" appears to have been the guiding principle :)","Jun 26, 2012 at 13:26",https://stackoverflow.com/questions/49495100/python-list-append-and-extend-gives-me-a-none-i-want-them-to-be-an-appended-and,"Why do these list operations (methods: clear / extend / reverse / append / sort / remove) return None, rather than the resulting list?",answer
scubbo,"I wish my past-self had thought to include the link to ""comments by Guido"" :( also, Tim, your first link to ""another answer"" also links to the Wikipedia page (though I suspect that you, too, currently lack the context to correct that)","Oct 17, 2019 at 20:50",https://stackoverflow.com/questions/49495100/python-list-append-and-extend-gives-me-a-none-i-want-them-to-be-an-appended-and,"Why do these list operations (methods: clear / extend / reverse / append / sort / remove) return None, rather than the resulting list?",answer
smci,"The alternative is 'fluent' notation (call chaining) e.g. PHP, Scala, R tidyverse, also sometimes implemented in JS, Java, C++. ""I find this behavior very intuitive"" is not a reason, it's a circular argument; you wouldn't if you'd learned the fluent paradigm. (Whether fluent is worse/better e.g. for maintainability, multithreading, etc. is a whole other very active debate.)","Dec 17, 2020 at 10:26",https://stackoverflow.com/questions/49495100/python-list-append-and-extend-gives-me-a-none-i-want-them-to-be-an-appended-and,"Why do these list operations (methods: clear / extend / reverse / append / sort / remove) return None, rather than the resulting list?",answer
scubbo,"Were type hints (and so, ""peeks"" at signature definitions in IDEs) in widespread use at that time? If not, I feel that it's unreasonable to expect a programmer to be regularly thinking about the signature of a method if they can't observe it with a mouseover/shortcut-key - I would have thought they would just assume the signature fits their expectations. Or was it possible to display signature definitions in IDEs without (prior to) type hints? I only really started using IDEs after type hints were popular, so I never put that to the test.",Aug 4 at 4:40,https://stackoverflow.com/questions/49495100/python-list-append-and-extend-gives-me-a-none-i-want-them-to-be-an-appended-and,"Why do these list operations (methods: clear / extend / reverse / append / sort / remove) return None, rather than the resulting list?",answer
Apurva Kunkulol,"@vaultah Please close the question, if you have the privileges.","Jul 20, 2017 at 14:31",https://stackoverflow.com/questions/45217650/extend-method-of-python-list,Extend method of Python list [duplicate],original
vaultah,"I can't, since I edited the tags. There should be a button saying ""That solved my problem"", you should click it","Jul 20, 2017 at 14:35",https://stackoverflow.com/questions/45217650/extend-method-of-python-list,Extend method of Python list [duplicate],original
Apurva Kunkulol,That button isn't there.,"Jul 21, 2017 at 7:55",https://stackoverflow.com/questions/45217650/extend-method-of-python-list,Extend method of Python list [duplicate],original
vaultah,"Why did you choose to answer this question? It's obviously a duplicate, and you could close it as such with your dupe hammer.","Jul 20, 2017 at 14:36",https://stackoverflow.com/questions/45217650/extend-method-of-python-list,Extend method of Python list [duplicate],answer
inspectorG4dget,@vaultah: didn't see the dup target before I answered. Was just trying to be helpful,"Jul 20, 2017 at 14:47",https://stackoverflow.com/questions/45217650/extend-method-of-python-list,Extend method of Python list [duplicate],answer
Matt,"Just to save anyone else a little time, if you need a default value in the event ""Pam"" just ain't in the list: next((item for item in dicts if item[""name""] == ""Pam""), None)","Nov 27, 2012 at 22:08",https://stackoverflow.com/questions/8653516/python-list-of-dictionaries-search,Python list of dictionaries search,answer
Moberg,"What about [item for item in dicts if item[""name""] == ""Pam""][0]?","Oct 9, 2014 at 11:30",https://stackoverflow.com/questions/8653516/python-list-of-dictionaries-search,Python list of dictionaries search,answer
Frédéric Hamidi,"@Moberg, that's still a list comprehension, so it will iterate over the whole input sequence regardless of the position of the matching item.","Oct 9, 2014 at 12:02",https://stackoverflow.com/questions/8653516/python-list-of-dictionaries-search,Python list of dictionaries search,answer
Kishan Mehta,This will raise stopiteration error if key is not present in dictionary,"Jun 5, 2018 at 12:25",https://stackoverflow.com/questions/8653516/python-list-of-dictionaries-search,Python list of dictionaries search,answer
Martijn Pieters,"@Siemkowski: then add enumerate() to generate a running index: next(i for i, item in enumerate(dicts) if item[""name""] == ""Pam"").","Nov 22, 2018 at 12:56",https://stackoverflow.com/questions/8653516/python-list-of-dictionaries-search,Python list of dictionaries search,answer
Onema,"Is worth noting that this answer returns a list with all matches for 'Pam' in people, alternatively we could get a list of all the people that are not 'Pam' by changing the comparison operator to !=. +1","Nov 12, 2015 at 22:25",https://stackoverflow.com/questions/8653516/python-list-of-dictionaries-search,Python list of dictionaries search,answer
wasabigeek,"Also worth mentioning that the result is a filter object, not a list - if you want to use things like len(), you need to call list() on the result first. Or: stackoverflow.com/questions/19182188/…","Dec 21, 2017 at 16:06",https://stackoverflow.com/questions/8653516/python-list-of-dictionaries-search,Python list of dictionaries search,answer
PaoloC,"@wasabigeek this is what my Python 2.7 says: people = [ {'name': ""Tom"", 'age': 10}, {'name': ""Mark"", 'age': 5}, {'name': ""Pam"", 'age': 7} ] r = filter(lambda person: person['name'] == 'Pam', people) type(r) list So r is a list","Dec 26, 2017 at 14:32",https://stackoverflow.com/questions/8653516/python-list-of-dictionaries-search,Python list of dictionaries search,answer
jrc,List comprehensions are considered more Pythonic than map/filter/reduce: stackoverflow.com/questions/5426754/google-python-style-guide,"Nov 11, 2019 at 12:58",https://stackoverflow.com/questions/8653516/python-list-of-dictionaries-search,Python list of dictionaries search,answer
xgMz,"Get the first match: next(filter(lambda x: x['name'] == 'Pam', dicts))","Dec 12, 2019 at 19:24",https://stackoverflow.com/questions/8653516/python-list-of-dictionaries-search,Python list of dictionaries search,answer
cwhisperer,"This is the best answer for Python 3.x. If you need a specific element from the dicts, like age, you can write: next((item.get('age') for item in dicts if item[""name""] == ""Pam""), False)","Jan 9, 2019 at 7:44",https://stackoverflow.com/questions/8653516/python-list-of-dictionaries-search,Python list of dictionaries search,answer
user3303554,"This is nice because it returns all matches if there is more than one. Not exactly what the question asked for, but it's what I needed! Thanks!","Aug 23, 2016 at 5:32",https://stackoverflow.com/questions/8653516/python-list-of-dictionaries-search,Python list of dictionaries search,answer
Abbas,Note also this returns a list!,"Apr 27, 2020 at 12:24",https://stackoverflow.com/questions/8653516/python-list-of-dictionaries-search,Python list of dictionaries search,answer
Martynas,"Is it possible to pass two conditions? such as if element['name'] == name and element['age'] == age? I tried it out, but doesn't seem to work, says element is undefined on the second condition.","Jun 24, 2020 at 8:34",https://stackoverflow.com/questions/8653516/python-list-of-dictionaries-search,Python list of dictionaries search,answer
hotenov,"@Martynas yes, it is possible. Don't forget to add an argument age to the function def search2(name, age, people): and don't forget to pass this argument, as well =). I've just tried two conditions and it works!","Aug 19, 2021 at 6:36",https://stackoverflow.com/questions/8653516/python-list-of-dictionaries-search,Python list of dictionaries search,answer
leon,I added function z() that implements next as pointed by Frédéric Hamidi above. Here are the results from Py profile.,"Mar 24, 2019 at 1:53",https://stackoverflow.com/questions/8653516/python-list-of-dictionaries-search,Python list of dictionaries search,answer
knowledge_seeker,Does anyone know why a list comprehension c() would be that much faster than simply iterating over the list a(),Oct 7 at 0:28,https://stackoverflow.com/questions/8653516/python-list-of-dictionaries-search,Python list of dictionaries search,answer
Ricky Robinson,It will return the first dictionary in the list with the given name.,"Jun 20, 2013 at 10:10",https://stackoverflow.com/questions/8653516/python-list-of-dictionaries-search,Python list of dictionaries search,answer
Jack James,"Just to make this very useful routine a little more generic: def search(list, key, value):     for item in list:         if item[key] == value:             return item","Aug 20, 2014 at 13:18",https://stackoverflow.com/questions/8653516/python-list-of-dictionaries-search,Python list of dictionaries search,answer
